subset,English,Español
gender,This map shows the ratio of women to men. Settlements with a high proportion of women will be red.,Este mapa muestra la proporción de mujeres a hombres. Los asentamientos con una alta proporción de mujeres serán de color rojo.
age,This map shows the percentage of the selected age group out of the total population for each settlement. Settlements with a high percentage of this age group will be red,Este mapa muestra el porcentaje del grupo de edad seleccionado de la población total para cada asentamiento. Los asentamientos con un alto porcentaje de este grupo de edad serán rojos
type,This map shows the selected settlement category. Settlements with higher populations will be red.,Este mapa muestra la categoría de liquidación seleccionada. Los asentamientos con poblaciones más altas serán rojos.
ethnicity,This map shows the percentage of the selected ethnicity out of the total population for each settlement. Settlements with a higher percentage of this ethnic group will be red.,Este mapa muestra el porcentaje de la etnicidad seleccionada de la población total para cada asentamiento. Los asentamientos con un mayor porcentaje de este grupo étnico serán de color rojo.
language,This map shows the percentage of the selected first language out of the total population for each settlement. Settlements with a higher percentage of this language group will be red.,Este mapa muestra el porcentaje del primer idioma seleccionado de la población total para cada asentamiento. Los asentamientos con un porcentaje más alto de este grupo de idiomas serán rojos.
indigeneity,This map shows settlements with a higher proportion of indigenous people with respect to non-indigenous people in red.,Este mapa muestra los asentamientos con una mayor proporción de indígenas con respecto a los no indígenas en rojo.
maya,This map shows the percentage of Mayans out of the total population for each settlement. Settlements with a higher percentage of Mayans will be red.,Este mapa muestra el porcentaje de mayas del total de la población para cada asentamiento. Los asentamientos con un mayor porcentaje de mayas serán rojos.